{
  "concept_id": "STD4_GEO_01",
  "grade": 4,
  "title_mr": "आयताची व चौरसाची परिमिती",
  "numeral_system_default": "DEVANAGARI",
  "rural_context_hook": {
    "scenario_title_mr": "शेताभोवती कुंपणाची तार घालणे",
    "mascot_speech_mr": "नमस्कार मित्रांनो! मी चिनू खारूताई. आजोबांना आपल्या आयताकृती भुईमुगाच्या शेताभोवती काटेरी तारेचे कुंपण घालायचे आहे. शेताची लांबी २० मीटर आणि रुंदी १० मीटर आहे. तारेची एकूण लांबी किती लागेल? चला परिमिती शोधूया!",
    "audio_asset_opus": "audio/std4/geo_01/hook_farm_fence.opus",
    "illustration_asset": "illustrations/std4/farm_fence.svg"
  },
  "manipulative_phase": {
    "manipulative_type": "GRID_BLOCKS",
    "columns": ["लांबी (मीटर)", "रुंदी (मीटर)"],
    "regrouping_rules": []
  },
  "spoken_explanation": [
    {
      "step_number": 1,
      "instruction_mr": "कोणत्याही बंदिस्त आकृतीच्या सर्व बाजूंच्या लांबीची बेरीज म्हणजेच तिची 'परिमिती' होय.",
      "audio_asset_opus": "audio/std4/geo_01/step_1_def.opus",
      "highlight_target": "perimeter_border"
    },
    {
      "step_number": 2,
      "instruction_mr": "आयताला समोरासमोरील बाजू समान असतात: लांबी २० + रुंदी १० + लांबी २० + रुंदी १० = एकूण ६० मीटर तार लागेल!",
      "audio_asset_opus": "audio/std4/geo_01/step_2_calc.opus",
      "highlight_target": "perimeter_sum"
    }
  ],
  "guided_practice": {
    "problem_instance": {
      "operands": [20, 10, 20, 10],
      "operation": "ADD",
      "expected_answer": 60
    },
    "scaffolded_hints": {
      "level_1_nudge": {
        "text_mr": "आयताच्या चारही बाजूंची बेरीज करा: २० + १० + २० + १० = ?",
        "audio_asset_opus": "audio/std4/geo_01/hint_l1.opus"
      },
      "level_2_visual_clue": {
        "text_mr": "बघा, शेताच्या कडेने लाल रंगाची तार चालत जाते आणि संपूर्ण फेरा पूर्ण होतो!",
        "audio_asset_opus": "audio/std4/geo_01/hint_l2.opus",
        "animation_trigger": "ANIM_PERIMETER_WALK"
      },
      "level_3_concrete_walkthrough": {
        "text_mr": "२० + १० = ३०, आणि ३० + २० = ५०, ५० + १० = ६० मीटर! म्हणून परिमिती ६० मीटर आहे.",
        "audio_asset_opus": "audio/std4/geo_01/hint_l3.opus"
      }
    },
    "misconception_diagnostics": [
      {
        "misconception_id": "MISCONCEPTION_HALF_PERIMETER",
        "wrong_answer_condition": "ANSWER == 30",
        "targeted_feedback_mr": "तुम्ही फक्त दोनच बाजूंची बेरीज केली! शेताला चार बाजू असतात, चारही बाजूंची बेरीज करा.",
        "targeted_audio_opus": "audio/std4/geo_01/err_half.opus"
      }
    ]
  },
  "independent_practice": {
    "kotlin_generator_name": "PerimeterCalculatorGenerator",
    "target_streak_to_pass": 3,
    "sample_problems": [
      { "operands": [15, 8, 15, 8], "expected_answer": 46 },
      { "operands": [25, 12, 25, 12], "expected_answer": 74 },
      { "operands": [30, 20, 30, 20], "expected_answer": 100 }
    ]
  },
  "explain_back_check": {
    "question_mr": "परिमिती म्हणजे नेमके काय?",
    "question_audio_opus": "audio/std4/geo_01/explain_q.opus",
    "options": [
      {
        "option_text_mr": "आकृतीच्या सर्व बाजूंच्या लांबींची एकूण बेरीज.",
        "option_audio_opus": "audio/std4/geo_01/opt_1.opus",
        "is_correct": true
      },
      {
        "option_text_mr": "आकृतीने व्यापलेली आतील सर्व जागा.",
        "option_audio_opus": "audio/std4/geo_01/opt_2.opus",
        "is_correct": false
      }
    ],
    "correct_option_index": 0
  },
  "spaced_review": {
    "review_intervals_days": [1, 3, 7],
    "retention_quiz_length": 2
  }
}
