{
  "concept_id": "STD6_INT_01",
  "grade": 6,
  "title_mr": "धन व ऋण संख्यांची ओळख (संख्यारेषा व दैनंदिन व्यवहार)",
  "numeral_system_default": "DEVANAGARI",
  "rural_context_hook": {
    "scenario_title_mr": "गावच्या विहिरीतील पाण्याची पातळी व तापमानातील चढ-उतार",
    "mascot_speech_mr": "नमस्कार मित्रांनो! मी चिनू खारूताई. उन्हाळ्यात आपल्या शेतातील विहिरीची पाण्याची पातळी जमिनीच्या पृष्ठभागावरून ३ मीटर खाली गेली. जमिनीची पातळी शून्य मानली तर विहिरीतील पाणी आपण कसे दर्शवणार? चला ऋण संख्यांची गंमत शिकूया!",
    "audio_asset_opus": "audio/std6/int_01/hook_well_depth.opus",
    "illustration_asset": "illustrations/std6/village_well.svg"
  },
  "manipulative_phase": {
    "manipulative_type": "NUMBER_LINE",
    "columns": ["ऋण संख्या (-)", "शून्य (०)", "धन संख्या (+)"],
    "regrouping_rules": []
  },
  "spoken_explanation": [
    {
      "step_number": 1,
      "instruction_mr": "जमिनीचा पृष्ठभाग किंवा समुद्राची पातळी ही 'शून्य (०)' मानली जाते.",
      "audio_asset_opus": "audio/std6/int_01/step_1_zero.opus",
      "highlight_target": "numline_zero"
    },
    {
      "step_number": 2,
      "instruction_mr": "शून्यापेक्षा वर असणारी उंची किंवा नफा 'धन संख्या (+)' दर्शवतात (उदा. झाडाची उंची +५ मीटर).",
      "audio_asset_opus": "audio/std6/int_01/step_2_positive.opus",
      "highlight_target": "numline_pos"
    },
    {
      "step_number": 3,
      "instruction_mr": "शून्यापेक्षा खाली जाणारी खोली किंवा तोटा 'ऋण संख्या (-)' दर्शवतात (उदा. विहिरीचे पाणी -३ मीटर).",
      "audio_asset_opus": "audio/std6/int_01/step_3_negative.opus",
      "highlight_target": "numline_neg"
    }
  ],
  "guided_practice": {
    "problem_instance": {
      "operands": [5, -3],
      "operation": "ADD",
      "expected_answer": 2
    },
    "scaffolded_hints": {
      "level_1_nudge": {
        "text_mr": "संख्यारेषेवर ५ वर उभे राहा आणि ३ घरे डावीकडे (ऋण दिशेने) चला. कोणत्या अंकावर पोहोचाल?",
        "audio_asset_opus": "audio/std6/int_01/hint_l1.opus"
      },
      "level_2_visual_clue": {
        "text_mr": "बघा, ५ वरून ३ उड्या मागे मारल्यावर आपण बरोबर +२ वर पोहोचलो!",
        "audio_asset_opus": "audio/std6/int_01/hint_l2.opus",
        "animation_trigger": "ANIM_NUMLINE_HOP"
      },
      "level_3_concrete_walkthrough": {
        "text_mr": "५ + (-३) म्हणजेच ५ - ३ = २! उत्तर धन २ आहे.",
        "audio_asset_opus": "audio/std6/int_01/hint_l3.opus"
      }
    },
    "misconception_diagnostics": [
      {
        "misconception_id": "MISCONCEPTION_SIGN_ADDITION",
        "wrong_answer_condition": "ANSWER == 8",
        "targeted_feedback_mr": "ऋण ३ म्हणजे मागे जाणे किंवा वजा करणे. ५ मध्ये ३ मिळवू नका, ३ वजा करा!",
        "targeted_audio_opus": "audio/std6/int_01/err_sign.opus"
      }
    ]
  },
  "independent_practice": {
    "kotlin_generator_name": "IntegerOperationGenerator",
    "target_streak_to_pass": 3,
    "sample_problems": [
      { "operands": [7, -4], "expected_answer": 3 },
      { "operands": [10, -6], "expected_answer": 4 },
      { "operands": [4, -4], "expected_answer": 0 }
    ]
  },
  "explain_back_check": {
    "question_mr": "जमिनीच्या पृष्ठभागावरून ३ मीटर खोल विहीर कोणत्या संख्येने दर्शवली जाते?",
    "question_audio_opus": "audio/std6/int_01/explain_q.opus",
    "options": [
      {
        "option_text_mr": "ऋण ३ (-३) मीटर.",
        "option_audio_opus": "audio/std6/int_01/opt_1.opus",
        "is_correct": true
      },
      {
        "option_text_mr": "धन ३ (+३) मीटर.",
        "option_audio_opus": "audio/std6/int_01/opt_2.opus",
        "is_correct": false
      }
    ],
    "correct_option_index": 0
  },
  "spaced_review": {
    "review_intervals_days": [1, 3, 7],
    "retention_quiz_length": 2
  }
}
